{
  "schema_version": "obs.recorder_degradation_decision.v1",
  "decision_id": "RD-battery-low-001",
  "reason": "battery_low",
  "actions": ["downsample", "drop_low_priority_signal", "shorten_retention"],
  "affected_signals": ["network.counters", "process.topN"],
  "preserved_signals": ["adc.self_overhead", "cpu.summary", "memory.summary"],
  "data_quality": {
    "dropped": false,
    "drop_count": 0,
    "throttled": true,
    "missing": [
      "network.counters disabled by battery_low policy"
    ],
    "truncated": false,
    "clock_confidence": "medium",
    "notes": [
      "resource policy degraded low-priority recorder signals before collection"
    ]
  }
}
